	Identifier                                : 0x03 (SFP)
	Extended identifier                       : 0x04 (GBIC/SFP defined by 2-wire interface ID)
	Connector                                 : 0x21 (Copper pigtail)
	Transceiver codes                         : 0x02 0x00 0x00 0x04 0x41 0x08 0x80 0x55 0x00
	Transceiver type                          : Infiniband: 1X Copper Active
	Transceiver type                          : Ethernet: 1000BASE-CX
	Transceiver type                          : FC: short distance (S)
	Transceiver type                          : FC: Electrical inter-enclosure (EL)
	Transceiver type                          : Active Cable
	Transceiver type                          : FC: Twin Axial Pair (TW)
	Transceiver type                          : FC: 800 MBytes/sec
	Transceiver type                          : FC: 400 MBytes/sec
	Transceiver type                          : FC: 200 MBytes/sec
	Transceiver type                          : FC: 100 MBytes/sec
	Encoding                                  : 0x00 (unspecified)
	BR, Nominal                               : 10300MBd
	Rate identifier                           : 0x00 (unspecified)
	Length (SMF,km)                           : 0km
	Length (SMF)                              : 0m
	Length (50um)                             : 0m
	Length (62.5um)                           : 0m
	Length (Copper)                           : 1m
	Length (OM3)                              : 0m
	Active Cu cmplnce.                        : 0x04 (SFF-8431 limiting) [SFF-8472 rev10.4 only]
	Vendor name                               : BROCADE
	Vendor OUI                                : 00:05:1e
	Vendor PN                                 : 58-1000026-01
	Vendor rev                                : A
	Option values                             : 0x00 0x12
	Option                                    : RX_LOS implemented
	Option                                    : TX_DISABLE implemented
	BR margin, max                            : 0%
	BR margin, min                            : 0%
	Vendor SN                                 : CAX110040000426
	Date code                                 : 100114
